[
  {
    "schemaVersion": 2,
    "eventId": "request-c0-parallel:1",
    "sequence": 1,
    "eventType": "ROUTE_SELECTED",
    "requestId": "request-c0-parallel",
    "runId": "run-c0-parallel",
    "attemptNo": null,
    "stepId": null,
    "subTaskId": null,
    "stepMode": null,
    "agentId": null,
    "agentName": null,
    "route": "ORCHESTRATED",
    "retryNo": null,
    "reasonCode": "MULTI_STEP",
    "errorCode": null,
    "steps": [],
    "completionStatus": null
  },
  {
    "schemaVersion": 2,
    "eventId": "request-c0-parallel:2",
    "sequence": 2,
    "eventType": "PLAN_CREATED",
    "requestId": "request-c0-parallel",
    "runId": "run-c0-parallel",
    "attemptNo": 1,
    "stepId": null,
    "subTaskId": null,
    "stepMode": null,
    "agentId": null,
    "agentName": null,
    "route": null,
    "retryNo": null,
    "reasonCode": null,
    "errorCode": null,
    "steps": [
      {
        "stepId": "step-1",
        "mode": "PARALLEL_AGENTS",
        "agentId": null,
        "agentName": null,
        "objective": "Confirm current status",
        "inputRefs": [],
        "subTasks": [
          {
            "subTaskId": "step-1-memory",
            "agentId": "agent-memory-001",
            "agentName": "Memory Agent",
            "objective": "Check memory state"
          },
          {
            "subTaskId": "step-1-research",
            "agentId": "agent-research-001",
            "agentName": "Research Agent",
            "objective": "Gather external facts"
          }
        ]
      }
    ],
    "completionStatus": null
  },
  {
    "schemaVersion": 2,
    "eventId": "request-c0-parallel:3",
    "sequence": 3,
    "eventType": "STEP_STARTED",
    "requestId": "request-c0-parallel",
    "runId": "run-c0-parallel",
    "attemptNo": 1,
    "stepId": "step-1",
    "subTaskId": null,
    "stepMode": "PARALLEL_AGENTS",
    "agentId": null,
    "agentName": null,
    "route": null,
    "retryNo": 0,
    "reasonCode": null,
    "errorCode": null,
    "steps": [],
    "completionStatus": null
  },
  {
    "schemaVersion": 2,
    "eventId": "request-c0-parallel:4",
    "sequence": 4,
    "eventType": "PARALLEL_STARTED",
    "requestId": "request-c0-parallel",
    "runId": "run-c0-parallel",
    "attemptNo": 1,
    "stepId": "step-1",
    "subTaskId": null,
    "stepMode": "PARALLEL_AGENTS",
    "agentId": null,
    "agentName": null,
    "route": null,
    "retryNo": 0,
    "reasonCode": null,
    "errorCode": null,
    "steps": [],
    "completionStatus": null
  },
  {
    "schemaVersion": 2,
    "eventId": "request-c0-parallel:5",
    "sequence": 5,
    "eventType": "SUBTASK_STARTED",
    "requestId": "request-c0-parallel",
    "runId": "run-c0-parallel",
    "attemptNo": 1,
    "stepId": "step-1",
    "subTaskId": "step-1-memory",
    "stepMode": "PARALLEL_AGENTS",
    "agentId": "agent-memory-001",
    "agentName": "Memory Agent",
    "route": null,
    "retryNo": 0,
    "reasonCode": null,
    "errorCode": null,
    "steps": [],
    "completionStatus": null
  },
  {
    "schemaVersion": 2,
    "eventId": "request-c0-parallel:6",
    "sequence": 6,
    "eventType": "SUBTASK_STARTED",
    "requestId": "request-c0-parallel",
    "runId": "run-c0-parallel",
    "attemptNo": 1,
    "stepId": "step-1",
    "subTaskId": "step-1-research",
    "stepMode": "PARALLEL_AGENTS",
    "agentId": "agent-research-001",
    "agentName": "Research Agent",
    "route": null,
    "retryNo": 0,
    "reasonCode": null,
    "errorCode": null,
    "steps": [],
    "completionStatus": null
  },
  {
    "schemaVersion": 2,
    "eventId": "request-c0-parallel:7",
    "sequence": 7,
    "eventType": "SUBTASK_COMPLETED",
    "requestId": "request-c0-parallel",
    "runId": "run-c0-parallel",
    "attemptNo": 1,
    "stepId": "step-1",
    "subTaskId": "step-1-memory",
    "stepMode": "PARALLEL_AGENTS",
    "agentId": "agent-memory-001",
    "agentName": "Memory Agent",
    "route": null,
    "retryNo": 0,
    "reasonCode": null,
    "errorCode": null,
    "steps": [],
    "completionStatus": null
  },
  {
    "schemaVersion": 2,
    "eventId": "request-c0-parallel:8",
    "sequence": 8,
    "eventType": "SUBTASK_COMPLETED",
    "requestId": "request-c0-parallel",
    "runId": "run-c0-parallel",
    "attemptNo": 1,
    "stepId": "step-1",
    "subTaskId": "step-1-research",
    "stepMode": "PARALLEL_AGENTS",
    "agentId": "agent-research-001",
    "agentName": "Research Agent",
    "route": null,
    "retryNo": 0,
    "reasonCode": null,
    "errorCode": null,
    "steps": [],
    "completionStatus": null
  },
  {
    "schemaVersion": 2,
    "eventId": "request-c0-parallel:9",
    "sequence": 9,
    "eventType": "STEP_REVIEW_STARTED",
    "requestId": "request-c0-parallel",
    "runId": "run-c0-parallel",
    "attemptNo": 1,
    "stepId": "step-1",
    "subTaskId": null,
    "stepMode": "PARALLEL_AGENTS",
    "agentId": null,
    "agentName": null,
    "route": null,
    "retryNo": 0,
    "reasonCode": null,
    "errorCode": null,
    "steps": [],
    "completionStatus": null
  },
  {
    "schemaVersion": 2,
    "eventId": "request-c0-parallel:10",
    "sequence": 10,
    "eventType": "STEP_COMPLETED",
    "requestId": "request-c0-parallel",
    "runId": "run-c0-parallel",
    "attemptNo": 1,
    "stepId": "step-1",
    "subTaskId": null,
    "stepMode": "PARALLEL_AGENTS",
    "agentId": null,
    "agentName": null,
    "route": null,
    "retryNo": 0,
    "reasonCode": null,
    "errorCode": null,
    "steps": [],
    "completionStatus": null
  },
  {
    "schemaVersion": 2,
    "eventId": "request-c0-parallel:11",
    "sequence": 11,
    "eventType": "FINAL_RESPONSE",
    "requestId": "request-c0-parallel",
    "runId": "run-c0-parallel",
    "attemptNo": 1,
    "stepId": null,
    "subTaskId": null,
    "stepMode": null,
    "agentId": null,
    "agentName": null,
    "route": "ORCHESTRATED",
    "retryNo": null,
    "reasonCode": null,
    "errorCode": null,
    "steps": [],
    "completionStatus": "SUCCESS"
  }
]
