[
  {
    "schemaVersion": 2,
    "eventId": "request-c0-same-agent:1",
    "sequence": 1,
    "eventType": "ROUTE_SELECTED",
    "requestId": "request-c0-same-agent",
    "runId": "run-c0-same-agent",
    "attemptNo": null,
    "stepId": null,
    "subTaskId": null,
    "stepMode": null,
    "agentId": null,
    "agentName": null,
    "route": "ORCHESTRATED",
    "retryNo": null,
    "reasonCode": "MULTI_STEP",
    "errorCode": null,
    "steps": [],
    "completionStatus": null
  },
  {
    "schemaVersion": 2,
    "eventId": "request-c0-same-agent:2",
    "sequence": 2,
    "eventType": "PLAN_CREATED",
    "requestId": "request-c0-same-agent",
    "runId": "run-c0-same-agent",
    "attemptNo": 1,
    "stepId": null,
    "subTaskId": null,
    "stepMode": null,
    "agentId": null,
    "agentName": null,
    "route": null,
    "retryNo": null,
    "reasonCode": null,
    "errorCode": null,
    "steps": [
      {
        "stepId": "step-1",
        "mode": "PARALLEL_AGENTS",
        "agentId": null,
        "agentName": null,
        "objective": "Run two probes with same agent",
        "inputRefs": [],
        "subTasks": [
          {
            "subTaskId": "step-1-probe-a",
            "agentId": "agent-research-001",
            "agentName": "Research Agent",
            "objective": "Probe angle A"
          },
          {
            "subTaskId": "step-1-probe-b",
            "agentId": "agent-research-001",
            "agentName": "Research Agent",
            "objective": "Probe angle B"
          }
        ]
      }
    ],
    "completionStatus": null
  },
  {
    "schemaVersion": 2,
    "eventId": "request-c0-same-agent:3",
    "sequence": 3,
    "eventType": "PARALLEL_STARTED",
    "requestId": "request-c0-same-agent",
    "runId": "run-c0-same-agent",
    "attemptNo": 1,
    "stepId": "step-1",
    "subTaskId": null,
    "stepMode": "PARALLEL_AGENTS",
    "agentId": null,
    "agentName": null,
    "route": null,
    "retryNo": 0,
    "reasonCode": null,
    "errorCode": null,
    "steps": [],
    "completionStatus": null
  },
  {
    "schemaVersion": 2,
    "eventId": "request-c0-same-agent:4",
    "sequence": 4,
    "eventType": "SUBTASK_STARTED",
    "requestId": "request-c0-same-agent",
    "runId": "run-c0-same-agent",
    "attemptNo": 1,
    "stepId": "step-1",
    "subTaskId": "step-1-probe-a",
    "stepMode": "PARALLEL_AGENTS",
    "agentId": "agent-research-001",
    "agentName": "Research Agent",
    "route": null,
    "retryNo": 0,
    "reasonCode": null,
    "errorCode": null,
    "steps": [],
    "completionStatus": null
  },
  {
    "schemaVersion": 2,
    "eventId": "request-c0-same-agent:5",
    "sequence": 5,
    "eventType": "SUBTASK_STARTED",
    "requestId": "request-c0-same-agent",
    "runId": "run-c0-same-agent",
    "attemptNo": 1,
    "stepId": "step-1",
    "subTaskId": "step-1-probe-b",
    "stepMode": "PARALLEL_AGENTS",
    "agentId": "agent-research-001",
    "agentName": "Research Agent",
    "route": null,
    "retryNo": 0,
    "reasonCode": null,
    "errorCode": null,
    "steps": [],
    "completionStatus": null
  },
  {
    "schemaVersion": 2,
    "eventId": "request-c0-same-agent:6",
    "sequence": 6,
    "eventType": "SUBTASK_COMPLETED",
    "requestId": "request-c0-same-agent",
    "runId": "run-c0-same-agent",
    "attemptNo": 1,
    "stepId": "step-1",
    "subTaskId": "step-1-probe-a",
    "stepMode": "PARALLEL_AGENTS",
    "agentId": "agent-research-001",
    "agentName": "Research Agent",
    "route": null,
    "retryNo": 0,
    "reasonCode": null,
    "errorCode": null,
    "steps": [],
    "completionStatus": null
  },
  {
    "schemaVersion": 2,
    "eventId": "request-c0-same-agent:7",
    "sequence": 7,
    "eventType": "SUBTASK_COMPLETED",
    "requestId": "request-c0-same-agent",
    "runId": "run-c0-same-agent",
    "attemptNo": 1,
    "stepId": "step-1",
    "subTaskId": "step-1-probe-b",
    "stepMode": "PARALLEL_AGENTS",
    "agentId": "agent-research-001",
    "agentName": "Research Agent",
    "route": null,
    "retryNo": 0,
    "reasonCode": null,
    "errorCode": null,
    "steps": [],
    "completionStatus": null
  },
  {
    "schemaVersion": 2,
    "eventId": "request-c0-same-agent:8",
    "sequence": 8,
    "eventType": "STEP_COMPLETED",
    "requestId": "request-c0-same-agent",
    "runId": "run-c0-same-agent",
    "attemptNo": 1,
    "stepId": "step-1",
    "subTaskId": null,
    "stepMode": "PARALLEL_AGENTS",
    "agentId": null,
    "agentName": null,
    "route": null,
    "retryNo": 0,
    "reasonCode": null,
    "errorCode": null,
    "steps": [],
    "completionStatus": null
  },
  {
    "schemaVersion": 2,
    "eventId": "request-c0-same-agent:9",
    "sequence": 9,
    "eventType": "FINAL_RESPONSE",
    "requestId": "request-c0-same-agent",
    "runId": "run-c0-same-agent",
    "attemptNo": 1,
    "stepId": null,
    "subTaskId": null,
    "stepMode": null,
    "agentId": null,
    "agentName": null,
    "route": "ORCHESTRATED",
    "retryNo": null,
    "reasonCode": null,
    "errorCode": null,
    "steps": [],
    "completionStatus": "SUCCESS"
  }
]
