[
  {
    "schemaVersion": 2,
    "eventId": "request-c0-fallback:1",
    "sequence": 1,
    "eventType": "ROUTE_SELECTED",
    "requestId": "request-c0-fallback",
    "runId": "run-c0-fallback",
    "attemptNo": null,
    "stepId": null,
    "subTaskId": null,
    "stepMode": null,
    "agentId": null,
    "agentName": null,
    "route": "ORCHESTRATED",
    "retryNo": null,
    "reasonCode": "MULTI_STEP",
    "errorCode": null,
    "steps": [],
    "completionStatus": null
  },
  {
    "schemaVersion": 2,
    "eventId": "request-c0-fallback:2",
    "sequence": 2,
    "eventType": "PLAN_CREATED",
    "requestId": "request-c0-fallback",
    "runId": "run-c0-fallback",
    "attemptNo": 1,
    "stepId": null,
    "subTaskId": null,
    "stepMode": null,
    "agentId": null,
    "agentName": null,
    "route": null,
    "retryNo": null,
    "reasonCode": null,
    "errorCode": null,
    "steps": [
      {
        "stepId": "step-1",
        "mode": "SINGLE_AGENT",
        "agentId": "agent-research-001",
        "agentName": "Research Agent",
        "objective": "Answer with possible fallback",
        "inputRefs": [],
        "subTasks": []
      }
    ],
    "completionStatus": null
  },
  {
    "schemaVersion": 2,
    "eventId": "request-c0-fallback:3",
    "sequence": 3,
    "eventType": "STEP_STARTED",
    "requestId": "request-c0-fallback",
    "runId": "run-c0-fallback",
    "attemptNo": 1,
    "stepId": "step-1",
    "subTaskId": null,
    "stepMode": "SINGLE_AGENT",
    "agentId": "agent-research-001",
    "agentName": "Research Agent",
    "route": null,
    "retryNo": 0,
    "reasonCode": null,
    "errorCode": null,
    "steps": [],
    "completionStatus": null
  },
  {
    "schemaVersion": 2,
    "eventId": "request-c0-fallback:4",
    "sequence": 4,
    "eventType": "STEP_FALLBACK_STARTED",
    "requestId": "request-c0-fallback",
    "runId": "run-c0-fallback",
    "attemptNo": 1,
    "stepId": "step-1",
    "subTaskId": null,
    "stepMode": "MAIN_ONLY",
    "agentId": null,
    "agentName": null,
    "route": null,
    "retryNo": 0,
    "reasonCode": "SUB_AGENT_FAILED",
    "errorCode": null,
    "steps": [],
    "completionStatus": null
  },
  {
    "schemaVersion": 2,
    "eventId": "request-c0-fallback:5",
    "sequence": 5,
    "eventType": "STEP_DEGRADED",
    "requestId": "request-c0-fallback",
    "runId": "run-c0-fallback",
    "attemptNo": 1,
    "stepId": "step-1",
    "subTaskId": null,
    "stepMode": "MAIN_ONLY",
    "agentId": null,
    "agentName": null,
    "route": null,
    "retryNo": 0,
    "reasonCode": "MAIN_FALLBACK",
    "errorCode": null,
    "steps": [],
    "completionStatus": null
  },
  {
    "schemaVersion": 2,
    "eventId": "request-c0-fallback:6",
    "sequence": 6,
    "eventType": "FINAL_RESPONSE",
    "requestId": "request-c0-fallback",
    "runId": "run-c0-fallback",
    "attemptNo": 1,
    "stepId": null,
    "subTaskId": null,
    "stepMode": null,
    "agentId": null,
    "agentName": null,
    "route": "ORCHESTRATED",
    "retryNo": null,
    "reasonCode": null,
    "errorCode": null,
    "steps": [],
    "completionStatus": "SUCCESS"
  }
]
