[
  {
    "schemaVersion": 2,
    "eventId": "request-c0-retry:1",
    "sequence": 1,
    "eventType": "ROUTE_SELECTED",
    "requestId": "request-c0-retry",
    "runId": "run-c0-retry",
    "attemptNo": null,
    "stepId": null,
    "subTaskId": null,
    "stepMode": null,
    "agentId": null,
    "agentName": null,
    "route": "ORCHESTRATED",
    "retryNo": null,
    "reasonCode": "MULTI_STEP",
    "errorCode": null,
    "steps": [],
    "completionStatus": null
  },
  {
    "schemaVersion": 2,
    "eventId": "request-c0-retry:2",
    "sequence": 2,
    "eventType": "PLAN_CREATED",
    "requestId": "request-c0-retry",
    "runId": "run-c0-retry",
    "attemptNo": 1,
    "stepId": null,
    "subTaskId": null,
    "stepMode": null,
    "agentId": null,
    "agentName": null,
    "route": null,
    "retryNo": null,
    "reasonCode": null,
    "errorCode": null,
    "steps": [
      {
        "stepId": "step-1",
        "mode": "PARALLEL_AGENTS",
        "agentId": null,
        "agentName": null,
        "objective": "Collect evidence with retry",
        "inputRefs": [],
        "subTasks": [
          {
            "subTaskId": "step-1-a",
            "agentId": "agent-research-001",
            "agentName": "Research Agent",
            "objective": "Collect A"
          },
          {
            "subTaskId": "step-1-b",
            "agentId": "agent-memory-001",
            "agentName": "Memory Agent",
            "objective": "Collect B"
          }
        ]
      }
    ],
    "completionStatus": null
  },
  {
    "schemaVersion": 2,
    "eventId": "request-c0-retry:3",
    "sequence": 3,
    "eventType": "PARALLEL_STARTED",
    "requestId": "request-c0-retry",
    "runId": "run-c0-retry",
    "attemptNo": 1,
    "stepId": "step-1",
    "subTaskId": null,
    "stepMode": "PARALLEL_AGENTS",
    "agentId": null,
    "agentName": null,
    "route": null,
    "retryNo": 0,
    "reasonCode": null,
    "errorCode": null,
    "steps": [],
    "completionStatus": null
  },
  {
    "schemaVersion": 2,
    "eventId": "request-c0-retry:4",
    "sequence": 4,
    "eventType": "SUBTASK_STARTED",
    "requestId": "request-c0-retry",
    "runId": "run-c0-retry",
    "attemptNo": 1,
    "stepId": "step-1",
    "subTaskId": "step-1-a",
    "stepMode": "PARALLEL_AGENTS",
    "agentId": "agent-research-001",
    "agentName": "Research Agent",
    "route": null,
    "retryNo": 0,
    "reasonCode": null,
    "errorCode": null,
    "steps": [],
    "completionStatus": null
  },
  {
    "schemaVersion": 2,
    "eventId": "request-c0-retry:5",
    "sequence": 5,
    "eventType": "SUBTASK_FAILED",
    "requestId": "request-c0-retry",
    "runId": "run-c0-retry",
    "attemptNo": 1,
    "stepId": "step-1",
    "subTaskId": "step-1-a",
    "stepMode": "PARALLEL_AGENTS",
    "agentId": "agent-research-001",
    "agentName": "Research Agent",
    "route": null,
    "retryNo": 0,
    "reasonCode": null,
    "errorCode": "TOOL_TIMEOUT",
    "steps": [],
    "completionStatus": null
  },
  {
    "schemaVersion": 2,
    "eventId": "request-c0-retry:6",
    "sequence": 6,
    "eventType": "STEP_RETRY_STARTED",
    "requestId": "request-c0-retry",
    "runId": "run-c0-retry",
    "attemptNo": 1,
    "stepId": "step-1",
    "subTaskId": "step-1-a",
    "stepMode": "PARALLEL_AGENTS",
    "agentId": "agent-research-001",
    "agentName": "Research Agent",
    "route": null,
    "retryNo": 1,
    "reasonCode": "SUBTASK_FAILED",
    "errorCode": null,
    "steps": [],
    "completionStatus": null
  },
  {
    "schemaVersion": 2,
    "eventId": "request-c0-retry:7",
    "sequence": 7,
    "eventType": "SUBTASK_STARTED",
    "requestId": "request-c0-retry",
    "runId": "run-c0-retry",
    "attemptNo": 1,
    "stepId": "step-1",
    "subTaskId": "step-1-a",
    "stepMode": "PARALLEL_AGENTS",
    "agentId": "agent-research-001",
    "agentName": "Research Agent",
    "route": null,
    "retryNo": 1,
    "reasonCode": null,
    "errorCode": null,
    "steps": [],
    "completionStatus": null
  },
  {
    "schemaVersion": 2,
    "eventId": "request-c0-retry:8",
    "sequence": 8,
    "eventType": "SUBTASK_COMPLETED",
    "requestId": "request-c0-retry",
    "runId": "run-c0-retry",
    "attemptNo": 1,
    "stepId": "step-1",
    "subTaskId": "step-1-a",
    "stepMode": "PARALLEL_AGENTS",
    "agentId": "agent-research-001",
    "agentName": "Research Agent",
    "route": null,
    "retryNo": 1,
    "reasonCode": null,
    "errorCode": null,
    "steps": [],
    "completionStatus": null
  },
  {
    "schemaVersion": 2,
    "eventId": "request-c0-retry:9",
    "sequence": 9,
    "eventType": "STEP_COMPLETED",
    "requestId": "request-c0-retry",
    "runId": "run-c0-retry",
    "attemptNo": 1,
    "stepId": "step-1",
    "subTaskId": null,
    "stepMode": "PARALLEL_AGENTS",
    "agentId": null,
    "agentName": null,
    "route": null,
    "retryNo": 1,
    "reasonCode": null,
    "errorCode": null,
    "steps": [],
    "completionStatus": null
  },
  {
    "schemaVersion": 2,
    "eventId": "request-c0-retry:10",
    "sequence": 10,
    "eventType": "FINAL_RESPONSE",
    "requestId": "request-c0-retry",
    "runId": "run-c0-retry",
    "attemptNo": 1,
    "stepId": null,
    "subTaskId": null,
    "stepMode": null,
    "agentId": null,
    "agentName": null,
    "route": "ORCHESTRATED",
    "retryNo": null,
    "reasonCode": null,
    "errorCode": null,
    "steps": [],
    "completionStatus": "SUCCESS"
  }
]
